[
  {
    "id": "fg.w.corrupted-pistol",
    "name": "Corrupted pistol",
    "team": "fellgor-ravagers",
    "type": "ranged",
    "atk": 4,
    "hit": "4+",
    "dmg": {
      "normal": 3,
      "crit": 5
    },
    "rules": [
      {
        "rule": "core.wr.range",
        "inches": 8
      },
      {
        "rule": "core.wr.rending"
      }
    ],
    "text": "Warp-tainted pistol carried by the Fellgor Ironhorn.",
    "source": "team-fellgor-ravagers.pdf (Aug '26); docs/spec/13-teams.md section 19.3"
  },
  {
    "id": "fg.w.plasma-pistol-standard",
    "name": "Plasma pistol",
    "team": "fellgor-ravagers",
    "type": "ranged",
    "atk": 4,
    "hit": "4+",
    "dmg": {
      "normal": 3,
      "crit": 5
    },
    "rules": [
      {
        "rule": "core.wr.range",
        "inches": 8
      },
      {
        "rule": "core.wr.piercing",
        "x": 1
      }
    ],
    "profileGroup": "fg.wg.plasma-pistol",
    "profile": "standard",
    "text": "Plasma pistol carried by the Fellgor Ironhorn.",
    "source": "team-fellgor-ravagers.pdf (Aug '26); docs/spec/13-teams.md section 19.3"
  },
  {
    "id": "fg.w.plasma-pistol-supercharge",
    "name": "Plasma pistol",
    "team": "fellgor-ravagers",
    "type": "ranged",
    "atk": 4,
    "hit": "4+",
    "dmg": {
      "normal": 4,
      "crit": 5
    },
    "rules": [
      {
        "rule": "core.wr.range",
        "inches": 8
      },
      {
        "rule": "core.wr.hot"
      },
      {
        "rule": "core.wr.lethal",
        "target": "5+"
      },
      {
        "rule": "core.wr.piercing",
        "x": 1
      }
    ],
    "profileGroup": "fg.wg.plasma-pistol",
    "profile": "supercharge",
    "text": "Plasma pistol carried by the Fellgor Ironhorn.",
    "source": "team-fellgor-ravagers.pdf (Aug '26); docs/spec/13-teams.md section 19.3"
  },
  {
    "id": "fg.w.bludgeon",
    "name": "Bludgeon",
    "team": "fellgor-ravagers",
    "type": "melee",
    "atk": 4,
    "hit": "3+",
    "dmg": {
      "normal": 4,
      "crit": 4
    },
    "rules": [
      {
        "rule": "core.wr.brutal"
      }
    ],
    "text": "Heavy club; the Ironhorn, Deathknell and Warriors carry the same profile.",
    "source": "team-fellgor-ravagers.pdf (Aug '26); docs/spec/13-teams.md section 19.3"
  },
  {
    "id": "fg.w.corrupted-chainsword",
    "name": "Corrupted chainsword",
    "team": "fellgor-ravagers",
    "type": "melee",
    "atk": 4,
    "hit": "3+",
    "dmg": {
      "normal": 4,
      "crit": 5
    },
    "rules": [
      {
        "rule": "core.wr.rending"
      }
    ],
    "text": "Warp-tainted chainsword carried by the Fellgor Ironhorn.",
    "source": "team-fellgor-ravagers.pdf (Aug '26); docs/spec/13-teams.md section 19.3"
  },
  {
    "id": "fg.w.autopistol",
    "name": "Autopistol",
    "team": "fellgor-ravagers",
    "type": "ranged",
    "atk": 4,
    "hit": "4+",
    "dmg": {
      "normal": 2,
      "crit": 3
    },
    "rules": [
      {
        "rule": "core.wr.range",
        "inches": 8
      }
    ],
    "text": "Light sidearm carried by most of the pack.",
    "source": "team-fellgor-ravagers.pdf (Aug '26); docs/spec/13-teams.md 19.3"
  },
  {
    "id": "fg.w.crackthorn-whip-ranged",
    "name": "Crackthorn whip",
    "team": "fellgor-ravagers",
    "type": "ranged",
    "atk": 4,
    "hit": "2+",
    "dmg": {
      "normal": 2,
      "crit": 3
    },
    "rules": [
      {
        "rule": "core.wr.range",
        "inches": 3
      },
      {
        "rule": "core.wr.lethal",
        "target": "4+"
      },
      {
        "rule": "core.wr.stun"
      }
    ],
    "text": "The Herd-Goad lashes out at a short reach; the crack of the whip leaves its prey reeling.",
    "source": "team-fellgor-ravagers.pdf (Aug '26); docs/spec/13-teams.md 19.3"
  },
  {
    "id": "fg.w.tech-curse",
    "name": "Tech-curse",
    "team": "fellgor-ravagers",
    "type": "ranged",
    "atk": 4,
    "hit": "3+",
    "dmg": {
      "normal": 1,
      "crit": 3
    },
    "rules": [
      {
        "rule": "fg.a.wr-psychic"
      },
      {
        "rule": "core.wr.rending"
      },
      {
        "rule": "core.wr.saturate"
      },
      {
        "rule": "core.wr.seek-light"
      }
    ],
    "text": "A warping curse flung at machines and the men who rely on them.",
    "source": "team-fellgor-ravagers.pdf (Aug '26); docs/spec/13-teams.md 19.3"
  },
  {
    "id": "fg.w.triple-cleavers",
    "name": "Triple cleavers",
    "team": "fellgor-ravagers",
    "type": "melee",
    "atk": 4,
    "hit": "3+",
    "dmg": {
      "normal": 4,
      "crit": 5
    },
    "rules": [
      {
        "rule": "core.wr.ceaseless"
      }
    ],
    "text": "Three heavy blades swung in a blur.",
    "source": "team-fellgor-ravagers.pdf (Aug '26); docs/spec/13-teams.md 19.3"
  },
  {
    "id": "fg.w.bionic-fist",
    "name": "Bionic fist",
    "team": "fellgor-ravagers",
    "type": "melee",
    "atk": 4,
    "hit": "3+",
    "dmg": {
      "normal": 4,
      "crit": 5
    },
    "rules": [
      {
        "rule": "core.wr.brutal"
      }
    ],
    "text": "A crude augmetic fist that crushes whatever it grips.",
    "source": "team-fellgor-ravagers.pdf (Aug '26); docs/spec/13-teams.md 19.3"
  },
  {
    "id": "fg.w.skullcleaver",
    "name": "Skullcleaver",
    "team": "fellgor-ravagers",
    "type": "melee",
    "atk": 4,
    "hit": "3+",
    "dmg": {
      "normal": 4,
      "crit": 5
    },
    "rules": [
      {
        "rule": "core.wr.lethal",
        "target": "5+"
      },
      {
        "rule": "fg.a.wr-headtaker"
      }
    ],
    "text": "A notched cleaver; every skull it takes feeds the Gorehorn.",
    "source": "team-fellgor-ravagers.pdf (Aug '26); docs/spec/13-teams.md 19.3"
  },
  {
    "id": "fg.w.crackthorn-whip-melee",
    "name": "Crackthorn whip",
    "team": "fellgor-ravagers",
    "type": "melee",
    "atk": 4,
    "hit": "3+",
    "dmg": {
      "normal": 2,
      "crit": 3
    },
    "rules": [
      {
        "rule": "core.wr.lethal",
        "target": "4+"
      },
      {
        "rule": "core.wr.shock"
      }
    ],
    "text": "The same whip used up close, to drive the herd and punish its enemies.",
    "source": "team-fellgor-ravagers.pdf (Aug '26); docs/spec/13-teams.md 19.3"
  },
  {
    "id": "fg.w.vicious-claws",
    "name": "Vicious claws",
    "team": "fellgor-ravagers",
    "type": "melee",
    "atk": 4,
    "hit": "4+",
    "dmg": {
      "normal": 4,
      "crit": 6
    },
    "rules": [
      {
        "rule": "core.wr.ceaseless"
      },
      {
        "rule": "fg.a.wr-tactual-hunter"
      }
    ],
    "text": "Hooked claws that tear into anything already spent.",
    "source": "team-fellgor-ravagers.pdf (Aug '26); docs/spec/13-teams.md 19.3"
  },
  {
    "id": "fg.w.braystave",
    "name": "Braystave",
    "team": "fellgor-ravagers",
    "type": "melee",
    "atk": 4,
    "hit": "3+",
    "dmg": {
      "normal": 3,
      "crit": 5
    },
    "rules": [
      {
        "rule": "core.wr.shock"
      }
    ],
    "text": "A staff topped with a horned skull, struck with ritual fury.",
    "source": "team-fellgor-ravagers.pdf (Aug '26); docs/spec/13-teams.md 19.3"
  },
  {
    "id": "fg.w.cleaver",
    "name": "Cleaver",
    "team": "fellgor-ravagers",
    "type": "melee",
    "atk": 4,
    "hit": "3+",
    "dmg": {
      "normal": 4,
      "crit": 5
    },
    "rules": [],
    "text": "A broad, heavy chopping blade.",
    "source": "team-fellgor-ravagers.pdf (Aug '26); docs/spec/13-teams.md 19.3"
  },
  {
    "id": "fg.w.mancrusher",
    "name": "Mancrusher",
    "team": "fellgor-ravagers",
    "type": "melee",
    "atk": 4,
    "hit": "4+",
    "dmg": {
      "normal": 5,
      "crit": 5
    },
    "rules": [
      {
        "rule": "core.wr.brutal"
      },
      {
        "rule": "fg.a.wr-vicious-blows"
      }
    ],
    "text": "A huge two-handed hammer; whatever it lands on does not stay in one piece.",
    "source": "team-fellgor-ravagers.pdf (Aug '26); docs/spec/13-teams.md 19.3"
  }
]
